{
  "scope_version": "0.1",
  "basis": "declared",
  "environment": "staging",
  "window": {
    "start": "2026-08-25T00:00:00Z",
    "end": "2026-08-25T01:00:00Z"
  },
  "collection_policy": {
    "id": "runtime-hourly-v1",
    "version": "1.0",
    "mode": "continuous"
  },
  "producers": [
    {
      "name": "postgres-audit-observer",
      "type": "database",
      "version": "0.1"
    },
    {
      "name": "otel-collector",
      "type": "collector",
      "version": "0.1"
    }
  ],
  "assumptions": [
    "Both declared producers were expected to collect for the complete stated window."
  ]
}
